{
  "topic_id": "deep-learning-m4-t2",
  "title": "RNN Gradients",
  "version": "1.0.0",
  "content": "# Ascendrite Revision Card: RNN Gradients & BPTT\n\n## Backpropagation Through Time (BPTT)\n\n*   **Temporal Unfolding:** The loss $J$ is summed over steps: $J = \\sum_{t=1}^T J_t$. Gradients for shared weights are summed temporally:\n    $$\\frac{\\partial J}{\\partial \\mathbf{W}_{hh}} = \\sum_{t=1}^T \\frac{\\partial J_t}{\\partial \\mathbf{W}_{hh}}$$\n*   **Chain Rule Pathway:** The gradient of step loss $J_t$ with respect to the recurrent weights depends on all previous hidden states:\n    $$\\frac{\\partial J_t}{\\partial \\mathbf{W}_{hh}} = \\sum_{k=1}^t \\frac{\\partial J_t}{\\partial \\mathbf{h}_t} \\cdot \\frac{\\partial \\mathbf{h}_t}{\\partial \\mathbf{h}_k} \\cdot \\frac{\\partial \\mathbf{h}_k}{\\partial \\mathbf{W}_{hh}}$$\n\n## Vanishing & Exploding Gradients Proof\n\n*   **Temporal Transition Jacobian:** The gradient flow term is a product of Jacobian matrices:\n    $$\\frac{\\partial \\mathbf{h}_t}{\\partial \\mathbf{h}_k} = \\prod_{i=k+1}^t \\frac{\\partial \\mathbf{h}_i}{\\partial \\mathbf{h}_{i-1}} = \\prod_{i=k+1}^t \\left( \\operatorname{diag}(1 - \\tanh^2(\\mathbf{z}_i)) \\cdot \\mathbf{W}_{hh}^\\top \\right)$$\n*   **Numerical Limits:** The norm of the gradient is bounded by:\n    $$\\left\\lVert \\frac{\\partial \\mathbf{h}_t}{\\partial \\mathbf{h}_k} \\right\\rVert \\le (\\gamma \\lVert \\mathbf{W}_{hh} \\rVert)^{t-k}$$\n    Where $\\gamma \\le 1.0$ is the activation derivative bound.\n    *   *Vanishing:* If $\\gamma \\lVert \\mathbf{W}_{hh} \\rVert < 1$, gradients decay exponentially to 0 as temporal distance $(t-k)$ increases, losing long-term dependencies.\n    *   *Exploding:* If spectral radius of $\\mathbf{W}_{hh} > 1$, gradients grow exponentially, causing numerical overflow (NaNs).\n\n## Gradient Norm Clipping\n\n*   **Formulation:** Limits gradient magnitudes while preserving vector direction:\n    $$\\mathbf{g}_{\\text{clip}} = \\min\\left(1, \\frac{\\theta}{\\lVert \\mathbf{g} \\rVert_2}\\right) \\mathbf{g}$$\n*   *Note:* Clipping does not solve vanishing gradients; it only prevents gradient explosion. Gated architectures (LSTMs/GRUs) are required to address vanishing gradients.\n"
}