{
  "topic_id": "css-frameworks-m1-t5",
  "title": "Typography & Colors",
  "version": "1.0.0",
  "content": "# CSS Frameworks Revision\n\n*   **Utility CSS:** Reuses utility class mappings, preventing custom style bloat.\n*   **Static Purging:** PostCSS static analysis removes unused utility rules from output bundles.\n*   **Dynamic Class Trap:** Do not write dynamic classes like `text-${color}`; static scanners will purge them.\n\n\n*   **Typography & Colors Checklist:** Verify input ranges and clear caches.\n"
}