{
  "topic_id": "nodejs-expressjs-m4-t3",
  "title": "Authentication",
  "version": "1.0.0",
  "content": "# NodeJS-ExpressJS Interview Prep\n\n## Q1: How does NodeJS resolve blocking I/O calls if JavaScript is single-threaded?\n\n### Standard Answer\nNodeJS delegates I/O calls to the kernel (using epoll/kqueue) or the background **libuv worker thread pool**. When an asynchronous call (such as a database query) is made, JavaScript registers a callback and halts execution. Once the background worker completes the query, it places the callback in the event loop queue, which is executed when the main thread call stack becomes empty.\n\n\n## Q2: How does the system handle concurrent throughput anomalies under Authentication?\n\n### Standard Answer\nThe system uses dynamic resource pools and queue-backoff throttles to maintain throughput boundaries, avoiding thread starvation.\n"
}