{
  "topic_id": "spring-boot-m3-t3",
  "title": "Relationships",
  "version": "1.0.0",
  "content": "# Spring Boot Interview Prep\n\n## Q1: Explain how the Spring IoC container resolves circular dependencies between singleton beans using the 3-Level Cache.\n\n### Standard Answer\nWhen instantiating Bean A, Spring places an ObjectFactory for A in the third cache (`singletonFactories`). During property injection, Spring notices A requires Bean B. It pauses A's creation and attempts to instantiate B. B requires A, so Spring checks caches. It finds A's factory in the third cache, generates a partially initialized reference to A, moves it to the second cache (`earlySingletonObjects`), and injects it into B. B completes initialization and is placed in the first cache (`singletonObjects`), allowing A's creation to complete.\n\n\n## Q2: What is the spatial complexity bounds of Relationships?\n\n### Standard Answer\nThe spatial complexity scales strictly as $O(1)$ auxiliary memory unless additional arrays or dynamic heap nodes are allocated, yielding $O(N)$ total space."
}