{
  "topic_id": "nodejs-expressjs-m4-t1",
  "title": "API Rate Limiting",
  "version": "1.0.0",
  "content": "# NodeJS-ExpressJS Revision\n\n*   **libuv event loop:** Timers $\\to$ Pending $\\to$ Poll $\\to$ Check $\\to$ Close. CPU-heavy tasks run in C++ thread pool.\n*   **Error Middleware Arity:** Must have 4 arguments `(err, req, res, next)`. Checked by Express via reflection.\n*   **Connection Pool:** Caches active database connections to avoid TCP handshakes on queries.\n\n\n*   **API Rate Limiting Checklist:** Verify input ranges and clear caches.\n"
}