{
  "topic_id": "deep-learning-m5-t4",
  "title": "Mixed Precision & Mixed Training",
  "version": "1.0.0",
  "content": "# Ascendrite Revision Card: Mixed Precision & Mixed Training\n\n## Numerical Bit Layouts\n\n*   **FP32:** 1 sign, 8 exponent, 23 fraction bits. Standard training precision.\n*   **FP16:** 1 sign, 5 exponent, 10 fraction bits. Range is restricted: $[6 \\times 10^{-5}, 65504]$. Narrow range leads to gradient underflow and overflow.\n*   **BF16:** 1 sign, 8 exponent, 7 fraction bits. Matches the dynamic range of FP32, preventing underflow. BF16 has lower precision (7 fraction bits) but is highly stable.\n\n## Master Weights & Precision Preservation\n\n*   **Master Weights copy:** Parameter weights are stored and updated in FP32. Forward and backward activation passes are run in FP16/BF16. Small updates would underflow if accumulated in FP16.\n\n## Loss Scaling Mathematics\n\n*   **Underflow:** Gradients below $6 \\times 10^{-5}$ drop to 0 in FP16.\n*   **Scaling:** Multiply the loss by a scaling factor $S$ (e.g. 1024) before backpropagation, shifting gradients into representable range:\n    $$\\mathbf{g}_{\\text{scaled}} = S \\cdot \\mathbf{g}$$\n*   **Unscaling:** Divide gradients by $S$ before optimizer updates:\n    $$\\mathbf{g}_{\\text{unscaled}} = \\frac{\\mathbf{g}_{\\text{scaled}}}{S}$$\n\n## Dynamic Scaling Protocol\n\n1.  Initialize scale factor $S$ to a large value (e.g. 65536).\n2.  Multiply loss by $S$, compute backpropagation.\n3.  **Check for overflow:** If gradients contain NaN or Inf:\n    *   Discard the optimizer step.\n    *   Scale down: $S \\leftarrow S \\cdot 0.5$.\n4.  If gradients are clean (no NaNs/Infs) for $N$ consecutive steps:\n    *   Scale up: $S \\leftarrow S \\cdot 2.0$.\n5.  *Note:* BF16 has the same exponent width as FP32, so it does not require loss scaling.\n"
}